{
 "id": "REV-000139",
 "target": "CMC-000002",
 "stage": "SPECIALIST_REVIEW",
 "reviewer": "n/a",
 "result": "NOT_REQUIRED",
 "reason": "U-1 roles are deliberately non-regulated general business roles; DRV-sensitive content excluded by constraint (author ruling 4 October 2026)",
 "findings": [],
 "date": "2026-10-04 21:52"
}
